{
  "actors": {
    "B_bot": "bot",
    "U_author": "human",
    "U_performer": "human",
    "git:email:b570f308b3fa3badb2c9eff5583f76ca8988ddde915a41d1b74465f507d182f4": "unlinked_git",
    "git:name:11ab89b0bbeeb7f5778466c8a2eefb39ad1b4008ebfaa0364baed0b8fb69542c": "unlinked_git"
  },
  "display_name": "example/project",
  "months": [
    {
      "metadata": {
        "is_partial": false,
        "month": "2024-02",
        "month_end": "2024-03-01T00:00:00Z",
        "month_start": "2024-02-01T00:00:00Z"
      },
      "source_reports": [
        {
          "metadata": {
            "coverage": {
              "as_of": "2024-03-02T12:00:00Z",
              "limitations": [
                "Titles and review states reflect collection-time metadata."
              ]
            },
            "default_branch": "main",
            "default_branch_head": "aaaaaaaaaaaaaaaaaaaaaaaaaaaaaaaaaaaaaaaa",
            "is_partial": false,
            "month": "2024-02",
            "month_end": "2024-03-01T00:00:00Z",
            "month_start": "2024-02-01T00:00:00Z",
            "provenance": {
              "created_by": {
                "collection_since": "2024-02-01T00:00:00Z",
                "collection_until": "2024-03-01T00:00:00Z",
                "collector_version": "0.1.0",
                "command": "manual",
                "commit_history": null,
                "finished_at": "2024-03-02T12:05:00Z",
                "mode": "rebuild",
                "parent_discovery": null,
                "requested_end_month": "2024-02",
                "requested_start_month": "2024-02",
                "run_id": "0143c935-d9ef-5173-b585-a2bfe6987ca4",
                "started_at": "2024-03-02T12:00:00Z"
              },
              "last_rebuilt_by": {
                "collection_since": "2024-02-01T00:00:00Z",
                "collection_until": "2024-03-01T00:00:00Z",
                "collector_version": "0.1.0",
                "command": "manual",
                "commit_history": null,
                "finished_at": "2024-03-02T12:05:00Z",
                "mode": "rebuild",
                "parent_discovery": null,
                "requested_end_month": "2024-02",
                "requested_start_month": "2024-02",
                "run_id": "0143c935-d9ef-5173-b585-a2bfe6987ca4",
                "started_at": "2024-03-02T12:00:00Z"
              },
              "last_updated_by": {
                "collection_since": "2024-02-01T00:00:00Z",
                "collection_until": "2024-03-01T00:00:00Z",
                "collector_version": "0.1.0",
                "command": "manual",
                "commit_history": null,
                "finished_at": "2024-03-02T12:05:00Z",
                "mode": "rebuild",
                "parent_discovery": null,
                "requested_end_month": "2024-02",
                "requested_start_month": "2024-02",
                "run_id": "0143c935-d9ef-5173-b585-a2bfe6987ca4",
                "started_at": "2024-03-02T12:00:00Z"
              }
            },
            "repository": {
              "created_at": "2020-01-01T00:00:00Z",
              "full_name": "example/project",
              "history_start_established_by": null,
              "history_start_month": null,
              "node_id": "R_example",
              "url": "https://github.com/example/project"
            }
          },
          "summaries": {
            "actor_counts": {
              "B_bot": {
                "commit": 0,
                "issue_closed": 0,
                "issue_comment": 0,
                "issue_opened": 0,
                "issue_reopened": 0,
                "pr_discussion_comment": 1,
                "pr_merged": 0,
                "pr_opened": 0,
                "pr_review": 0,
                "pr_review_comment": 1
              },
              "U_author": {
                "commit": 1,
                "issue_closed": 0,
                "issue_comment": 0,
                "issue_opened": 1,
                "issue_reopened": 0,
                "pr_discussion_comment": 0,
                "pr_merged": 0,
                "pr_opened": 1,
                "pr_review": 0,
                "pr_review_comment": 0
              },
              "U_performer": {
                "commit": 0,
                "issue_closed": 2,
                "issue_comment": 0,
                "issue_opened": 0,
                "issue_reopened": 2,
                "pr_discussion_comment": 0,
                "pr_merged": 1,
                "pr_opened": 0,
                "pr_review": 1,
                "pr_review_comment": 1
              },
              "git:email:b570f308b3fa3badb2c9eff5583f76ca8988ddde915a41d1b74465f507d182f4": {
                "commit": 1,
                "issue_closed": 0,
                "issue_comment": 0,
                "issue_opened": 0,
                "issue_reopened": 0,
                "pr_discussion_comment": 0,
                "pr_merged": 0,
                "pr_opened": 0,
                "pr_review": 0,
                "pr_review_comment": 0
              },
              "git:name:11ab89b0bbeeb7f5778466c8a2eefb39ad1b4008ebfaa0364baed0b8fb69542c": {
                "commit": 1,
                "issue_closed": 0,
                "issue_comment": 0,
                "issue_opened": 0,
                "issue_reopened": 0,
                "pr_discussion_comment": 0,
                "pr_merged": 0,
                "pr_opened": 0,
                "pr_review": 0,
                "pr_review_comment": 0
              }
            },
            "distinct_actors": {
              "bot": 1,
              "human": 2,
              "total": 5,
              "unlinked_git": 2
            },
            "distinct_actors_by_type": {
              "commit": {
                "bot": 0,
                "human": 1,
                "total": 3,
                "unlinked_git": 2
              },
              "issue_closed": {
                "bot": 0,
                "human": 1,
                "total": 1,
                "unlinked_git": 0
              },
              "issue_comment": {
                "bot": 0,
                "human": 0,
                "total": 0,
                "unlinked_git": 0
              },
              "issue_opened": {
                "bot": 0,
                "human": 1,
                "total": 1,
                "unlinked_git": 0
              },
              "issue_reopened": {
                "bot": 0,
                "human": 1,
                "total": 1,
                "unlinked_git": 0
              },
              "pr_discussion_comment": {
                "bot": 1,
                "human": 0,
                "total": 1,
                "unlinked_git": 0
              },
              "pr_merged": {
                "bot": 0,
                "human": 1,
                "total": 1,
                "unlinked_git": 0
              },
              "pr_opened": {
                "bot": 0,
                "human": 1,
                "total": 1,
                "unlinked_git": 0
              },
              "pr_review": {
                "bot": 0,
                "human": 1,
                "total": 1,
                "unlinked_git": 0
              },
              "pr_review_comment": {
                "bot": 1,
                "human": 1,
                "total": 2,
                "unlinked_git": 0
              }
            },
            "repository_counts": {
              "commit": 2,
              "issue_closed": 2,
              "issue_comment": 1,
              "issue_opened": 1,
              "issue_reopened": 2,
              "pr_discussion_comment": 1,
              "pr_merged": 1,
              "pr_opened": 1,
              "pr_review": 1,
              "pr_review_comment": 2
            },
            "unattributed_by_type": {
              "commit": 0,
              "issue_closed": 0,
              "issue_comment": 1,
              "issue_opened": 0,
              "issue_reopened": 0,
              "pr_discussion_comment": 0,
              "pr_merged": 0,
              "pr_opened": 0,
              "pr_review": 0,
              "pr_review_comment": 0
            },
            "unattributed_total": 1
          }
        }
      ],
      "summaries": {
        "actor_counts": {
          "B_bot": {
            "commit": 0,
            "issue_closed": 0,
            "issue_comment": 0,
            "issue_opened": 0,
            "issue_reopened": 0,
            "pr_discussion_comment": 1,
            "pr_merged": 0,
            "pr_opened": 0,
            "pr_review": 0,
            "pr_review_comment": 1
          },
          "U_author": {
            "commit": 1,
            "issue_closed": 0,
            "issue_comment": 0,
            "issue_opened": 1,
            "issue_reopened": 0,
            "pr_discussion_comment": 0,
            "pr_merged": 0,
            "pr_opened": 1,
            "pr_review": 0,
            "pr_review_comment": 0
          },
          "U_performer": {
            "commit": 0,
            "issue_closed": 2,
            "issue_comment": 0,
            "issue_opened": 0,
            "issue_reopened": 2,
            "pr_discussion_comment": 0,
            "pr_merged": 1,
            "pr_opened": 0,
            "pr_review": 1,
            "pr_review_comment": 1
          },
          "git:email:b570f308b3fa3badb2c9eff5583f76ca8988ddde915a41d1b74465f507d182f4": {
            "commit": 1,
            "issue_closed": 0,
            "issue_comment": 0,
            "issue_opened": 0,
            "issue_reopened": 0,
            "pr_discussion_comment": 0,
            "pr_merged": 0,
            "pr_opened": 0,
            "pr_review": 0,
            "pr_review_comment": 0
          },
          "git:name:11ab89b0bbeeb7f5778466c8a2eefb39ad1b4008ebfaa0364baed0b8fb69542c": {
            "commit": 1,
            "issue_closed": 0,
            "issue_comment": 0,
            "issue_opened": 0,